<?xml version="1.0" encoding="ISO-8859-1" ?>
<!DOCTYPE map SYSTEM "../../XML/dtd/language.dtd" >
<map>
    <!-- ä &#228; ö &#246; ü &#252; Ä &#196; Ö &#214; Ü &#220; <b> &lt;b&gt; </b> &lt;/b&gt; -->
    <local scope="ModuleNames">
        <prop mnemo="habasit">HABASIT</prop>
    </local>    
    <local scope="habasit">
        <prop mnemo="reportAveragePerformance">Leistungsbewertung</prop>
        <prop mnemo="reportDate">Datum</prop>
        <prop mnemo="reportSign">K&#252;rzel/Unterschrift</prop>
        <prop mnemo="reportSupervisor">Vorgesetzter</prop>
        <prop mnemo="reportClerk">Mitarbeiter</prop>
        <prop mnemo="reportSupervisorRating">Leistungsbewertung</prop>
        <prop mnemo="reportClerkRating">Selbstbewertung</prop>
        <prop mnemo="reportRatingDate">Datum Leistungsbewertung</prop>
        <prop mnemo="reportHigherSupervisor">H&#246;herer Vorgesetzter</prop>
        <prop mnemo="reportEmplRemarks">Bemerkungen des Mitarbeiters</prop>
    </local>
</map>