<?xml version="1.0" encoding="ISO-8859-1" ?>
<!DOCTYPE map SYSTEM "../../XML/dtd/language.dtd" >
<map>
    <!-- ä &#228; ö &#246; ü &#252; Ä &#196; Ö &#214; Ü &#220; <b> &lt;b&gt; </b> &lt;/b&gt; -->
    <local scope="ModuleNames">
        <prop mnemo="suggestion">VORSCHLAGSWESEN</prop>
    </local>
    <local scope="SUGGESTION">
 		<prop mnemo="TITLE_DE">Bezeichnung</prop>
 		<prop mnemo="DESCRIPTION_DE">Beschreibung</prop>
	 	<prop mnemo="CREATED">Kreiert</prop>
	 	<prop mnemo="ISPUBLIC">Öffentlich</prop>
	 	<prop mnemo="ISACTIVE">Vorschlagswesen Status</prop>
    </local>
    <local scope="SUGGESTION_STEP">
 		<prop mnemo="TITLE_DE">Bezeichnung</prop>
 		<prop mnemo="DESCRIPTION_DE" size="50,5">Beschreibung</prop>
    </local>
    <local scope="SUGGESTION_QUESTION">
 		<prop mnemo="TITLE_DE">Bezeichnung</prop>
 		<prop mnemo="QUESTION_DE">Frage</prop>
	 	<prop mnemo="TYP">Typ</prop>
	 	<prop mnemo="ANSWERREQUIRED">Pflichtantwort</prop>
	 	<prop mnemo="DATE_MIN">Datumsbereich ab</prop>
	 	<prop mnemo="DATE_MAX">Datumsbereich bis</prop>
	 	<prop mnemo="NUMBER_MIN">Zahlenbereich ab</prop>
	 	<prop mnemo="NUMBER_MAX">Zahlenbereich bis</prop>
	 	<prop mnemo="CHARS_MIN">Min. Anzahl Zeichen</prop>
	 	<prop mnemo="CHARS_MAX">Max. Anzahl Zeichen</prop>
 		<prop mnemo="RESOLUTION_TEXT_DE">Lösung</prop>
	 	<prop mnemo="RESOLUTION_DATE">Lösung</prop>
	 	<prop mnemo="RESOLUTION_NUMBER">Lösung</prop>
	 	<prop mnemo="RESOLUTION_BOOLEAN">Lösung</prop>
	 	<prop mnemo="RESOLUTION_COMMENT_DE">Lösungskommentar</prop>
    </local>
    <local scope="SUGGESTION_ANSWEROPTION">
 		<prop mnemo="LABEL_DE">Bezeichnung</prop>
	 	<prop mnemo="VALUE_DE">Rückgabewert</prop>
	 	<prop mnemo="ISRESOLUTION">Ist richtige Antwort</prop>
    </local>
    <local scope="SUGGESTION_EXECUTION">
 		<prop mnemo="TITLE">Bezeichnung</prop>
 		<prop mnemo="CREATED">Datum</prop>
	 	<prop mnemo="PERSON_ID">Benutzer</prop>
	 	<prop mnemo="SURVEY_ID">Vorschlagswesen</prop>
	 	<prop mnemo="ISFINISHED">Status</prop>
    </local>

    <local scope="suggestion">
	 	<prop mnemo="suggestion">Vorschlagswesen</prop>
	 	<prop mnemo="step">Schritt</prop>
	 	<prop mnemo="nextStep">Nächster Schritt &gt;&gt;</prop>
	 	<prop mnemo="previousStep">&lt;&lt; Vorheriger Schritt</prop>
	 	<prop mnemo="finish">Vorschlag zwischenspeichern</prop>
        <prop mnemo="sendToKnowledge">Vorschlag einreichen</prop>
	 	<prop mnemo="noExecutionTitle">Unbekannt</prop>
	 	<prop mnemo="subNavTitle">Vorschagswesen</prop>
	 	<prop mnemo="subNavSearchSuggestion">Vorschagswesen suchen</prop>
        <prop mnemo="subNavOwnSuggestionExecutions">Eigene Vorschläge</prop>
        <prop mnemo="subNavAllSuggestionExecutions">Alle Vorschläge</prop>	 	
        <prop mnemo="subNavAllSuggestionExecutionsMatrix">Vorschlägematrix</prop>        	 	
	 	<prop mnemo="valAnswerRequired">Bitte beantworten Sie diese Frage!</prop>
	 	<prop mnemo="valOutOfRange">Eingabe liegt ausserhalb des gültigen Bereichs.</prop>
	 	<prop mnemo="valRangeTextMin">Der eingegebene Text muss mindestens #1 Zeichen enthalten.</prop>
	 	<prop mnemo="valRangeTextMax">Der eingegebene Text darf maximal #1 Zeichen enthalten.</prop>
	 	<prop mnemo="valRangeTextMinMax">Der eingegebene Text muss zwischen #1 und #2 Zeichen enthalten.</prop>
	 	<prop mnemo="valRangeNumberMin">Die eingegebene Zahl muss grösser als #1 sein.</prop>
	 	<prop mnemo="valRangeNumberMax">Die eingegebene Zahl darf nicht grösser als #1 sein.</prop>
	 	<prop mnemo="valRangeNumberMinMax">Die eingegebene Zahl muss zwischen #1 und #2 sein.</prop>
	 	<prop mnemo="valInfoRangeNumberMinMax">Zahl zwischen #1 und #2</prop>
	 	<prop mnemo="valInfoRangeNumberMin">Zahl ab #1</prop>
	 	<prop mnemo="valInfoRangeNumberMax">Zahl bis #1</prop>	 	
	 	<prop mnemo="valRangeDateMin">Das eingegebene Datum muss nach #1 sein.</prop>
	 	<prop mnemo="valRangeDateMax">Das eingegebene Datum darf nicht nach #1 sein.</prop>
	 	<prop mnemo="valRangeDateMinMax">Das eingegebene Datum muss zwischen #1 und #2 sein.</prop>
	 	<prop mnemo="valInfoRangeDateMinMax">Datum zwischen #1 und #2</prop>	 	
	 	<prop mnemo="valInfoRangeDateMin">Datum ab #1</prop>	 	
	 	<prop mnemo="valInfoRangeDateMax">Datum bis #1</prop>	 		 	
	 	<prop mnemo="bcSearchSuggestion">Vorschagswesen suchen</prop>
	 	<prop mnemo="ctSuggestionSearchresult">Folgende Vorschagswesen wurden gefunden:</prop>
	 	<prop mnemo="ctSuggestionSelection">Vorschagswesen gemäss Selektion:</prop>
	 	<prop mnemo="ctExecutableSuggestions">Von #1 durchführbare Vorschagswesen:</prop>
	 	<prop mnemo="ctSuggestionExecutions">#1</prop>
	 	<prop mnemo="ctExecutionSelection">Durchführungen gemäss Selektion:</prop>
	 	<prop mnemo="cmExecuteSuggestion">Vorschlag erfassen</prop>
	 	<prop mnemo="cmShowExecutions">Durchführungen anzeigen</prop>
	 	<prop mnemo="cmtSelectedSuggestion">Vorschlagswesen</prop>
	 	<prop mnemo="cmtListedSuggestions">Vorschagswesen in Liste</prop>
	 	<prop mnemo="labelFreeText">Antwort</prop>
        <prop mnemo="labelYesOrNo">Ja/Nein</prop>
        <prop mnemo="labelDate">Datum</prop>
        <prop mnemo="labelNumber">Nummer</prop>
        <prop mnemo="textCreatorPerson">Erstellt durch</prop>
        <prop mnemo="cmLinkToKnowledge">Wissenselement</prop>
        <prop mnemo="deleteSuggKnow">Löschen des Vorschlags und des Wissenselements</prop>
        <prop mnemo="ciNoActiveSuggestionFound">Zurzeit ist kein Vorschlagswesen aktiv</prop>
        <prop mnemo="ciNoActiveSubmittedExecutionFound">Es sind zurzeit keine eingereichten Vorschläge vorhanden.</prop>
        <prop mnemo="ttMatrixTitle">Titel</prop>
        <prop mnemo="ttMatrixDate">Erfasst</prop>
        <prop mnemo="ttMatrixRating">Bewertung</prop>
        <prop mnemo="ttMatrixRemark">Bemerkung zur Bewertung</prop> 
        <prop mnemo="btnGenerateExcelFile">Excel Datei erzeugen</prop>               
        <enum name="finishedEnum">
            <prop mnemo="0">In Bearbeitung</prop>
            <prop mnemo="1">Gespeichert (noch nicht gesendet)</prop>
            <prop mnemo="2">Gesendet</prop>
        </enum> 
    </local>
    <local scope="suggestion_execution">
	 	<prop mnemo="stateNew">In Bearbeitung</prop>
	 	<prop mnemo="stateComplete">Gespeichert (noch nicht gesendet)</prop>
	 	<prop mnemo="stateSent">Gesendet</prop>	 	
	</local>
</map>