<?xml version="1.0" encoding="ISO-8859-1" ?>
<!DOCTYPE map SYSTEM "../../XML/dtd/language.dtd" >
<map>
    <!-- ä &#228; ö &#246; ü &#252; Ä &#196; Ö &#214; Ü &#220; <b> &lt;b&gt; </b> &lt;/b&gt; -->
    <local scope="ModuleNames">
        <prop mnemo="rsr">LOHN</prop>
    </local>
    <local scope="rsr">
        <prop mnemo="salaryChangePercentage">Lohnänderung in %</prop>
        <prop mnemo="salaryPercentageOfProposed">% vom Richtlohn</prop>
        <prop mnemo="proposedSalaryDifference">Differenz zum Richtlohn</prop>
        <prop mnemo="proposedSalaryPercentageDifference">Differenz zum Richtlohn in %</prop>
        <prop mnemo="salaireBudgetAllocation">Budget für Lohnmassnahmen</prop>
        <prop mnemo="primeBudgetAllocation">Budget für Prämien</prop>
        <prop mnemo="salaireadjustment">Lohnmassnahmen vornehmen</prop>
        <prop mnemo="primeadjustment">Prämieneingabe</prop>
        <prop mnemo="salaireApprovement">Genehmigung der Lohnmassnahmen</prop>
        <prop mnemo="primeApprovement">Genehmigung der Prämien</prop>
        <prop mnemo="salaireBudgetCheck">Budgetkontrolle für Lohnmassnahmen</prop>
        <prop mnemo="primeBudgetCheck">Budgetkontrolle für Prämien</prop>
        <prop mnemo="salaireoverview">Lohnmassnahmen Überblick</prop>
        <prop mnemo="primeoverview">Prämien Überblick</prop>
        <prop mnemo="salaireExport">Lohn exportieren</prop>
        <prop mnemo="primeExport">Pr&#228;mie exportieren</prop>
        <prop mnemo="salarySituation">Lohnsituation #1</prop>
        <prop mnemo="situation">Situation #1</prop>
        <prop mnemo="salaireLink">Lohnmassnahmen</prop>
        <prop mnemo="primeLink">Prämien</prop>
        <prop mnemo="prime">Prämie</prop>
    </local>
    <local scope="PERSON">
        <prop mnemo="AGE">Alter</prop>
    </local>
    <local scope="FUNKTION">
        <prop mnemo="TITLE_DE_REP">Stellvertredende Funktion</prop>
    </local>
    <local scope="JOB">
        <prop mnemo="REPFUNKTION_BONUS">Stellvertretende Funktionszulage</prop>
    </local>
    <local scope="EMPLOYMENT">
        <prop mnemo="EMPLOYMENTTYP">Anstellungsvertrag</prop>
        <prop mnemo="EMPLOYMENTKIND">Anstellungsverhältnis</prop>
        <prop mnemo="COSTCENTER_NUMBER">Kostenstelle</prop>
        <prop mnemo="COSTCENTER_DESCRIPTION">Kostenstelle</prop>
        <prop mnemo="SUPERIOR">Hierarchisch Vorgesetzter</prop>
    </local>
    <local scope="RSR_LOHNDATEN_V" alias="LOHN">
        <prop mnemo="PNAME">Name</prop>
        <prop mnemo="FIRSTNAME">Vorname</prop>
        <prop mnemo="ENTRY">Eintrittsdatum</prop>
        <prop mnemo="AGE">Alter</prop>
        <prop mnemo="TITLE_DE">Anstellung</prop>
        <prop mnemo="ENGAGEMENT">Beschäftigungsgrad</prop>
        <prop mnemo="EMPLOYMENTTYP">Anstellungsvertrag</prop>
        <prop mnemo="EMPLOYMENTKIND">Anstellungsverhältnis</prop>
        <prop mnemo="COSTCENTER_NUMBER">Kostenstelle</prop>
        <prop mnemo="COSTCENTER_DESCRIPTION">Kostenstelle</prop>
        <prop mnemo="SUPERIOR">Hierarchisch Vorgesetzter</prop>
        <prop mnemo="SALAIRE">Lohnänderung</prop>
        <prop mnemo="PRIME">Prämie</prop>
        <prop mnemo="INDEMNITE_DE_FONCTION">Funktionszulage</prop>
        <prop mnemo="FORFAIT_B">Forfaits B</prop>
        <prop mnemo="ISTLOHN">Istlohn</prop>
        <prop mnemo="LOHNVORSCHLAG">Richtlohn</prop>
    	<prop mnemo="NEUER_LOHN">Neuer Lohn</prop>
        <prop mnemo="KOMMENTARS">Kommentar Salär</prop>
        <prop mnemo="KOMMENTARP">Kommentar Prämie</prop>
        <prop mnemo="INFORMATIONP">Information Prämie</prop>
        <prop mnemo="INFORMATIONS">Kommentar Salär</prop>
        <prop mnemo="REPRICHTLOHN">Stellvertredender Richtlohn</prop>
    </local>
    <local scope="RSR_LISTE_V" alias="PERSON">
        <prop mnemo="TITLE_DE">Funktion</prop>
        <prop mnemo="BUDGETTYP_ID">Budget</prop>
        <prop mnemo="EMPLOYMENTTYP">Anstellungsvertrag</prop>
        <prop mnemo="EMPLOYMENTKIND">Anstellungsverhältnis</prop>
        <prop mnemo="COSTCENTER_NUMBER">Kostenstelle</prop>
        <prop mnemo="COSTCENTER_DESCRIPTION">Kostenstelle</prop>
        <prop mnemo="SUPERIOR">Hierarch. Vorgesetzter</prop>
    	<prop mnemo="ISTLOHN">Istlohn</prop>
    	<prop mnemo="NEUER_LOHN">Neuer Lohn</prop>
    	<prop mnemo="RICHTLOHN">Richtlohn</prop>
    	<prop mnemo="LOHNVORSCHLAG">Richtlohn</prop>
    	<prop mnemo="ZUNAHME_PROZENT">% Erhöhung</prop>
    	<prop mnemo="VARIANTE_ID">Variante</prop>
        <prop mnemo="BEARBEITUNGSSTATUS">Status</prop>
        <prop mnemo="BETRAG">Lohnanpassung Jahr Fr</prop>
        <prop mnemo="BETRAG_PRO_STUNDE">Lohnanpassung Std Fr</prop>
        <prop mnemo="ISTLOHN_PROZENT">Ist % vom Richtlohn</prop>
    	<prop mnemo="NEUER_LOHN_PRO_ISTLOHN">%</prop>
    	<prop mnemo="NEUER_STUNDENLOHN">Neuer Stundenlohn</prop>
    	<prop mnemo="NEUER_LOHN_PROZENT">Neu % vom Richtlohn</prop>
        <prop mnemo="KOMMENTARS">Kommentar</prop>
        <prop mnemo="KOMMENTARP">Kommentar</prop>
        <prop mnemo="ENGAGEMENT">Beschäftigung</prop>
        <prop mnemo="VERGLEICH">Vergleichsstundenlohn</prop>
    </local>
    <local scope="SALAIRE" alias="RSR_LISTE_V">
    </local>
    <local scope="PRIME" alias="RSR_LISTE_V">
    </local>
    <local scope="OVERVIEW_SALAIRE" alias="RSR_LISTE_V">
    </local>
    <local scope="OVERVIEW_PRIME" alias="RSR_LISTE_V">
    </local>
</map>